{
  "$schema": "https://json-schema.org/draft/2020-12/schema",
  "title": "AIDailyCandidateLedger",
  "type": "object",
  "required": ["version", "type", "date", "generated_at", "items"],
  "properties": {
    "version": {"enum": [
      "1.0",
      "1.1",
      "1.2"
    ]},
    "type": {"const": "daily_candidate_ledger"},
    "date": {"type": "string", "pattern": "^\\d{4}-\\d{2}-\\d{2}$"},
    "generated_at": {"type": "string"},
    "items": {
      "type": "array",
      "items": {"$ref": "#/$defs/candidateRecord"}
    }
  },
  "$defs": {
    "candidateRecord": {
      "type": "object",
      "required": [
        "candidate_id",
        "headline",
        "proposed_section",
        "published_at",
        "source_attempt_refs",
        "verification_state",
        "editorial_tier",
        "decision",
        "decision_reason",
        "novelty_vs_yesterday",
        "event_type",
        "date_basis",
        "evidence_path",
        "why_today",
        "action_eligibility"
      ],
      "properties": {
        "candidate_id": {"type": "string", "minLength": 1},
        "headline": {"type": "string", "minLength": 1},
        "proposed_section": {"enum": [
          "frontier_models",
          "coding_agents",
          "general_agents",
          "unverified",
          "policy_risk",
          "vertical_agents"
        ]},
        "published_at": {"type": "string", "minLength": 1},
        "source_attempt_refs": {
          "type": "array",
          "minItems": 1,
          "items": {"type": "string", "minLength": 1}
        },
        "verification_state": {"type": "string", "minLength": 1},
        "editorial_tier": {"enum": ["core", "watch", "unverified", "not_applicable"]},
        "decision": {
          "enum": ["selected_core", "selected_watch", "selected_unverified", "rejected_window", "rejected_duplicate", "rejected_weak_evidence", "rejected_not_ai", "rejected_low_relevance"]
        },
        "decision_reason": {"type": "string", "minLength": 1},
        "novelty_vs_yesterday": {"type": "string", "minLength": 1},
        "event_type": {"enum": ["model_release", "coding_release", "partnership", "pricing", "benchmark", "compliance", "community_signal", "enterprise_update", "adoption_signal", "research_update", "agent_product_update", "safety_incident"]},
        "date_basis": {"enum": ["official_event_date", "release_metadata", "section_date", "article_published_at", "page_updated_at", "community_snapshot_time", "inferred_from_search"]},
        "evidence_path": {"enum": ["primary", "media_plus_official_one_hop", "media_only", "community_snapshot", "search_only"]},
        "why_today": {"type": "string", "minLength": 1},
        "action_eligibility": {"enum": ["none", "monitor", "experiment", "full_action"]},
        "tracking_ref": {"type": "string", "pattern": "^[a-z0-9][a-z0-9-]{2,63}$"},
        "subject_kind": {"enum": ["product", "capability", "platform", "research_system", "institution", "industry"]},
        "section_reason": {"type": "string", "minLength": 1, "pattern": "\\S"},
        "claim_support": {
          "type": "array",
          "minItems": 1,
          "items": {
            "type": "object",
            "required": ["claim", "direct_attempt_refs", "background_attempt_refs", "unresolved_questions"],
            "properties": {
              "claim": {"type": "string", "minLength": 1, "pattern": "\\S"},
              "direct_attempt_refs": {
                "type": "array",
                "items": {"type": "string", "minLength": 1, "pattern": "\\S"}
              },
              "background_attempt_refs": {
                "type": "array",
                "items": {"type": "string", "minLength": 1, "pattern": "\\S"}
              },
              "unresolved_questions": {
                "type": "array",
                "items": {"type": "string", "minLength": 1, "pattern": "\\S"}
              }
            },
            "additionalProperties": false
          }
        },
        "task_domain": {
          "type": "string",
          "minLength": 1,
          "pattern": "\\S"
        },
        "capability_layer": {
          "enum": [
            "execution",
            "platform"
          ]
        }

      },
      "allOf": [
        {
          "if": {
            "properties": {"decision": {"enum": ["selected_core", "selected_watch"]}},
            "required": ["decision"]
          },
          "then": {
            "not": {
              "properties": {"date_basis": {"const": "page_updated_at"}},
              "required": ["date_basis"]
            }
          }
        }
      ]
    }
  },
  "allOf": [
    {
      "if": {
        "properties": {
          "version": {
            "enum": [
              "1.1",
              "1.2"
            ]
          }
        },
        "required": [
          "version"
        ]
      },
      "then": {
        "properties": {
          "items": {
            "items": {
              "required": [
                "subject_kind",
                "section_reason",
                "claim_support"
              ]
            }
          }
        }
      }
    },
    {
      "if": {
        "properties": {
          "version": {
            "const": "1.2"
          }
        },
        "required": [
          "version"
        ]
      },
      "then": {
        "properties": {
          "items": {
            "items": {
              "properties": {
                "proposed_section": {
                  "enum": [
                    "frontier_models",
                    "general_agents",
                    "vertical_agents",
                    "policy_risk",
                    "unverified"
                  ]
                }
              },
              "if": {
                "properties": {
                  "proposed_section": {
                    "enum": [
                      "general_agents",
                      "vertical_agents"
                    ]
                  }
                },
                "required": [
                  "proposed_section"
                ]
              },
              "then": {
                "required": [
                  "task_domain",
                  "capability_layer"
                ]
              }
            }
          }
        }
      },
      "else": {
        "properties": {
          "items": {
            "items": {
              "properties": {
                "proposed_section": {
                  "not": {
                    "const": "vertical_agents"
                  }
                }
              }
            }
          }
        }
      }
    }
  ]
}
